{
  "severity": "HIGH",
  "reviewed_sha": "3f8a1c2e9b7d4f60a1b2c3d4e5f60718293a4b5c",
  "location": {
    "file": "src/collisions/assess.ts",
    "symbol": "assessCollisions"
  },
  "defect": "evidence retrieval failure is treated as empty diff",
  "scenario": "GitHub diff request fails; assessment reports isolated",
  "impact": "conflicting tasks may be integrated without required reconciliation",
  "evidence": "exact code path on reviewed SHA",
  "fix": "propagate failure; add regression for unavailable evidence"
}
